{"schema":"lattice.todo_extraction.v2","project_id":"lattice","plan_key":"phase-audit-and-cli-discovery","plan_version":"v1","actor":{"host":"codex-link-macbook","session":"sess-20260730","agent":"bell-claude-fable5"},"recorded_at":"2026-07-30T00:07:58.534Z","tasks":[{"task_id":"t01-adr","title":"終端監査 gate と Phase 獲得 policy の設計を ADR に記録する（何が閉じを止めるか・acquire_phase の意味論・作成時通知の形）","lane":"design","narrative_ref":"docs/plan_phase-audit-and-cli-discovery.md","compile_binding":null,"disposition":"register_pending","start":null,"completion":null,"source":{"origin_plan_ref":"docs/plan_phase-audit-and-cli-discovery.md","origin_line":83,"source_commit":"897de1bad7dee68a7f0434b01aa4f1c8c4310901","heading_path":["重監査を飛ばせない工程管理と、authoring CLI の発見可能性 — 統括 plan","ToDo（Lattice store への移転用 source）","終端重監査の機構"],"markdown_depth":3,"parent_task_id":null,"checkbox_state":"unchecked"},"migration_context":{"external_canonical_ref":null,"carry_over_ref":null,"h_required":false,"condition":null,"evidence_refs":[],"notes":[]}},{"task_id":"t02-final-audit-gate","title":"phase 無し plan の終端重監査 gate を実装する（全 task done でも監査記録なしでは閉じない・作成時に明示・テスト込み）","lane":"store","narrative_ref":"docs/plan_phase-audit-and-cli-discovery.md","compile_binding":null,"disposition":"register_pending","start":null,"completion":null,"source":{"origin_plan_ref":"docs/plan_phase-audit-and-cli-discovery.md","origin_line":84,"source_commit":"897de1bad7dee68a7f0434b01aa4f1c8c4310901","heading_path":["重監査を飛ばせない工程管理と、authoring CLI の発見可能性 — 統括 plan","ToDo（Lattice store への移転用 source）","終端重監査の機構"],"markdown_depth":3,"parent_task_id":null,"checkbox_state":"unchecked"},"migration_context":{"external_canonical_ref":null,"carry_over_ref":null,"h_required":false,"condition":null,"evidence_refs":[],"notes":[]}},{"task_id":"t03-acquire-phase","title":"revise-phase に Phase 獲得専用の state_policy を実装する（実行状態を保持・他の意味論変化は従来どおり拒否・テスト込み）","lane":"store","narrative_ref":"docs/plan_phase-audit-and-cli-discovery.md","compile_binding":null,"disposition":"register_pending","start":null,"completion":null,"source":{"origin_plan_ref":"docs/plan_phase-audit-and-cli-discovery.md","origin_line":88,"source_commit":"897de1bad7dee68a7f0434b01aa4f1c8c4310901","heading_path":["重監査を飛ばせない工程管理と、authoring CLI の発見可能性 — 統括 plan","ToDo（Lattice store への移転用 source）","done を保つ Phase 獲得"],"markdown_depth":3,"parent_task_id":null,"checkbox_state":"unchecked"},"migration_context":{"external_canonical_ref":null,"carry_over_ref":null,"h_required":false,"condition":null,"evidence_refs":[],"notes":[]}},{"task_id":"t04-schema-default","title":"plan create --schema --json の既定を最新版にする（または非最新である旨を出力へ含める・テスト込み）","lane":"cli","narrative_ref":"docs/plan_phase-audit-and-cli-discovery.md","compile_binding":null,"disposition":"register_pending","start":null,"completion":null,"source":{"origin_plan_ref":"docs/plan_phase-audit-and-cli-discovery.md","origin_line":92,"source_commit":"897de1bad7dee68a7f0434b01aa4f1c8c4310901","heading_path":["重監査を飛ばせない工程管理と、authoring CLI の発見可能性 — 統括 plan","ToDo（Lattice store への移転用 source）","authoring CLI の発見可能性"],"markdown_depth":3,"parent_task_id":null,"checkbox_state":"unchecked"},"migration_context":{"external_canonical_ref":null,"carry_over_ref":null,"h_required":false,"condition":null,"evidence_refs":[],"notes":[]}},{"task_id":"t05-schema-flags","title":"revise / revise-set / revise-phase / migrate に --schema --json を実装する（テスト込み）","lane":"cli","narrative_ref":"docs/plan_phase-audit-and-cli-discovery.md","compile_binding":null,"disposition":"register_pending","start":null,"completion":null,"source":{"origin_plan_ref":"docs/plan_phase-audit-and-cli-discovery.md","origin_line":93,"source_commit":"897de1bad7dee68a7f0434b01aa4f1c8c4310901","heading_path":["重監査を飛ばせない工程管理と、authoring CLI の発見可能性 — 統括 plan","ToDo（Lattice store への移転用 source）","authoring CLI の発見可能性"],"markdown_depth":3,"parent_task_id":null,"checkbox_state":"unchecked"},"migration_context":{"external_canonical_ref":null,"carry_over_ref":null,"h_required":false,"condition":null,"evidence_refs":[],"notes":[]}},{"task_id":"t06-error-fields","title":"スキーマ違反エラーの detail に違反フィールド名と位置を載せる（テスト込み）","lane":"cli","narrative_ref":"docs/plan_phase-audit-and-cli-discovery.md","compile_binding":null,"disposition":"register_pending","start":null,"completion":null,"source":{"origin_plan_ref":"docs/plan_phase-audit-and-cli-discovery.md","origin_line":94,"source_commit":"897de1bad7dee68a7f0434b01aa4f1c8c4310901","heading_path":["重監査を飛ばせない工程管理と、authoring CLI の発見可能性 — 統括 plan","ToDo（Lattice store への移転用 source）","authoring CLI の発見可能性"],"markdown_depth":3,"parent_task_id":null,"checkbox_state":"unchecked"},"migration_context":{"external_canonical_ref":null,"carry_over_ref":null,"h_required":false,"condition":null,"evidence_refs":[],"notes":[]}},{"task_id":"t07-plan-show","title":"lattice plan show を実装し、bindings が空を返すことでの誤読を解消する（テスト込み）","lane":"cli","narrative_ref":"docs/plan_phase-audit-and-cli-discovery.md","compile_binding":null,"disposition":"register_pending","start":null,"completion":null,"source":{"origin_plan_ref":"docs/plan_phase-audit-and-cli-discovery.md","origin_line":95,"source_commit":"897de1bad7dee68a7f0434b01aa4f1c8c4310901","heading_path":["重監査を飛ばせない工程管理と、authoring CLI の発見可能性 — 統括 plan","ToDo（Lattice store への移転用 source）","authoring CLI の発見可能性"],"markdown_depth":3,"parent_task_id":null,"checkbox_state":"unchecked"},"migration_context":{"external_canonical_ref":null,"carry_over_ref":null,"h_required":false,"condition":null,"evidence_refs":[],"notes":[]}},{"task_id":"t08-docs","title":"docs（製品契約・README・CHANGELOG）を実装へ揃える","lane":"docs","narrative_ref":"docs/plan_phase-audit-and-cli-discovery.md","compile_binding":null,"disposition":"register_pending","start":null,"completion":null,"source":{"origin_plan_ref":"docs/plan_phase-audit-and-cli-discovery.md","origin_line":99,"source_commit":"897de1bad7dee68a7f0434b01aa4f1c8c4310901","heading_path":["重監査を飛ばせない工程管理と、authoring CLI の発見可能性 — 統括 plan","ToDo（Lattice store への移転用 source）","閉じ"],"markdown_depth":3,"parent_task_id":null,"checkbox_state":"unchecked"},"migration_context":{"external_canonical_ref":null,"carry_over_ref":null,"h_required":false,"condition":null,"evidence_refs":[],"notes":[]}},{"task_id":"t09-release","title":"npm test 全 green を確認し、version bump → push → npm publish → npm install → 公開後 smoke まで通す","lane":"release","narrative_ref":"docs/plan_phase-audit-and-cli-discovery.md","compile_binding":null,"disposition":"register_pending","start":null,"completion":null,"source":{"origin_plan_ref":"docs/plan_phase-audit-and-cli-discovery.md","origin_line":100,"source_commit":"897de1bad7dee68a7f0434b01aa4f1c8c4310901","heading_path":["重監査を飛ばせない工程管理と、authoring CLI の発見可能性 — 統括 plan","ToDo（Lattice store への移転用 source）","閉じ"],"markdown_depth":3,"parent_task_id":null,"checkbox_state":"unchecked"},"migration_context":{"external_canonical_ref":null,"carry_over_ref":null,"h_required":false,"condition":null,"evidence_refs":[],"notes":[]}},{"task_id":"t10-report","title":"オーナーへ最終報告（実施 / スキップ理由 / 検証結果）","lane":"docs","narrative_ref":"docs/plan_phase-audit-and-cli-discovery.md","compile_binding":null,"disposition":"register_pending","start":null,"completion":null,"source":{"origin_plan_ref":"docs/plan_phase-audit-and-cli-discovery.md","origin_line":101,"source_commit":"897de1bad7dee68a7f0434b01aa4f1c8c4310901","heading_path":["重監査を飛ばせない工程管理と、authoring CLI の発見可能性 — 統括 plan","ToDo（Lattice store への移転用 source）","閉じ"],"markdown_depth":3,"parent_task_id":null,"checkbox_state":"unchecked"},"migration_context":{"external_canonical_ref":null,"carry_over_ref":null,"h_required":false,"condition":null,"evidence_refs":[],"notes":[]}}],"hard_dependencies":[{"from":{"project_id":"lattice","plan_key":"phase-audit-and-cli-discovery","task_id":"t01-adr"},"to":{"project_id":"lattice","plan_key":"phase-audit-and-cli-discovery","task_id":"t02-final-audit-gate"}},{"from":{"project_id":"lattice","plan_key":"phase-audit-and-cli-discovery","task_id":"t01-adr"},"to":{"project_id":"lattice","plan_key":"phase-audit-and-cli-discovery","task_id":"t03-acquire-phase"}},{"from":{"project_id":"lattice","plan_key":"phase-audit-and-cli-discovery","task_id":"t08-docs"},"to":{"project_id":"lattice","plan_key":"phase-audit-and-cli-discovery","task_id":"t09-release"}},{"from":{"project_id":"lattice","plan_key":"phase-audit-and-cli-discovery","task_id":"t09-release"},"to":{"project_id":"lattice","plan_key":"phase-audit-and-cli-discovery","task_id":"t10-report"}}],"joins":[],"extraction_digest":"9fafe7a88a37483ad004aa447034dc6d1b12f30957f5c46a3222b754b9c6e904"}
